{
  "schemaVersion": 1,
  "id": "hello-world",
  "displayName": "Arcane Hello World",
  "version": "0.1.0",
  "entry": "index.html",
  "strategy": "static",
  "security": {
    "connectOrigins": [
      "https://huggingface.co"
    ],
    "frameOrigins": [],
    "mediaOrigins": []
  },
  "include": [
    "hello-world.css",
    "index.html",
    "manifest.json",
    "modules"
  ],
  "exclude": [],
  "shared": [
    "browser-runtime"
  ]
}
