{
  "schemaVersion": 1,
  "id": "mail-browser-proof",
  "displayName": "Arcane Mail Browser Proof",
  "version": "0.1.0",
  "entry": "index.html",
  "strategy": "static",
  "include": ["mail-browser-proof.css", "index.html", "manifest.json", "modules"],
  "exclude": [],
  "shared": ["browser-runtime"]
}
